{
  "schema_version": "1.0.0",
  "schema_lock": {
    "path": "world/map-production/schemas/protected-relief-composite-v1.schema.json",
    "sha256": "4e6a46e9c183777209c1a512b0bc98605855ea7a0435ffd6abe1082c799fb97b"
  },
  "id": "style-candidate-g-v2-generation-control-v1",
  "coordinate_space": "source-pixels-y-down",
  "canvas": {"width": 1536, "height": 1024},
  "prompt": {
    "path": "world/map-production/prompts/style-candidate-g-v2-orthographic-hachure.generation.txt",
    "sha256": "9c6af16c5a104930656c8e7d3cb6d98d93df854a079a581ded5a24423657c5b7"
  },
  "references": [
    {
      "index": 1,
      "path": "world/map-production/candidates/style-candidate-d-v4-erase-route-marks.png",
      "sha256": "c8c15f3e0fba49165c5d85f8369b91e7171d88d7059a58c0948e0d1339864016",
      "format": "PNG",
      "mode": "RGB",
      "role": "pixel-authoritative-base"
    },
    {
      "index": 2,
      "path": "world/map-production/controls/style-candidate-g-v2-topology-guide.png",
      "sha256": "a6c8815d5f1a769a6ebfeda8478cf52f586fdb3fd11156c734c3e43d9b6b188f",
      "format": "PNG",
      "mode": "RGB",
      "role": "flat-color-topology-guide"
    }
  ],
  "guide_contract": {
    "source_control": {
      "path": "world/map-production/controls/style-candidate-g-v2-topology-guide.json",
      "sha256": "9646d14a89dfd7fd9dccba3d1d3bd14fe9b492623d8850d2d7524c5ff42adc01"
    },
    "background_rgb": [128, 128, 128],
    "active_colors": [
      {"role": "main-massif", "rgb": [206, 74, 62], "expected_components": 2},
      {"role": "foothill-a", "rgb": [232, 151, 61], "expected_components": 2},
      {"role": "foothill-b", "rgb": [126, 93, 178], "expected_components": 2}
    ],
    "expected_components": 6,
    "permission_feather_inside_px": 24
  },
  "road_protection": {
    "guard_width_px": 64,
    "feather_px": 8,
    "strokes": [
      {
        "id": "north_road",
        "points": [[1085,160],[1060,180],[1035,200],[1005,225],[982,250],[970,280],[966,320],[960,350],[946,375],[918,400],[910,425],[900,455],[895,485]]
      },
      {
        "id": "east_road",
        "points": [[930,505],[1050,515],[1180,540],[1270,535],[1370,490],[1535,450]]
      },
      {
        "id": "south_east_road",
        "points": [[910,558],[1000,610],[1090,666],[1180,725],[1270,785],[1360,840],[1450,892],[1535,936]]
      }
    ]
  },
  "detail_protection": {
    "gaussian_radius_px": 3,
    "high_frequency_threshold_levels": 18,
    "dark_luminance_max": 105,
    "feather_px": 0
  },
  "purpose": "Hash-lock the G2 orthographic hachure prompt and six complete smooth footprints while preserving the exact G1 64px road guard and high-frequency/dark detail core. Terrain generation must remain continuous beneath protected roads; only the deterministic composite creates the authoritative road gaps."
}
